{
  "version": 1,
  "id": "",
  "name": "",
  "handle": "",
  "site": "",
  "people": [],
  "colors": {"ink": "#111318", "base": "#FFFFFF", "accent": "#2F6FED", "on_accent": "#FFFFFF", "negative": "#E3161B", "bg": "#111318", "card": "#1C1F26"},
  "surface": {"background": "rgba(28,31,38,0.94)", "border": "1px solid rgba(255,255,255,0.08)"},
  "fonts": {
    "display": {"family": "", "file": "", "weights": {}, "fallback": "sans-serif"},
    "running": null,
    "mono": null
  },
  "type": {"caps": false, "skew": 0},
  "logo": {"emblem": null, "lockup": null, "lockup_dark": null},
  "captions": {
    "case": "mixed",
    "zone": "chest",
    "width": 860,
    "top_y0": 200,
    "hero_max": 250,
    "row_px": [112, 132],
    "chin_gap": 90,
    "chip": false,
    "hero_base": null,
    "hero_shadow": "0 3px 18px rgba(0,0,0,0.45), 0 0 2px rgba(0,0,0,0.5)",
    "hero_stroke": null,
    "text_opacity": 1.0,
    "text_soften": 0,
    "whip_frames": 3,
    "whip_amount": 1.0,
    "caption_tier_max": "FULL",
    "soft_build": false,
    "default_style": "clean-clusters",
    "pace_gate": "report",
    "devices": "off",
    "master_audio": "off",
    "hero_glow": true,
    "hero_tint": null,
    "glow_px": 12,
    "chip_neg": null,
    "neg_words": [],
    "count_up": true,
    "places": [],
    "cta_wash": null,
    "page_bg": null,
    "page_ink": null,
    "display_weight": 800,
    "pill_bg": null,
    "pill_ink": null,
    "icon_words": [],
    "pill_icons": [],
    "feel": "",
    "look_note": "",
    "text_hook": "on"
  },
  "feed_captions": {"words_per_page": 3, "size_px": 84, "stroke_px": 0, "top_px": 1190},
  "hook": {"on": true, "look": "card", "top_px": 300, "size_px": null, "font": "display", "hold_s": [3.0, 6.5]},
  "formats": {"home": "talking-head", "list": ["talking-head"]},
  "motion": {
    "level": "light",
    "transitions_allowed": ["hard-cut", "punch-in", "zoom-through"],
    "transitions_banned": ["spin", "glitch", "3d", "shutter"],
    "punches": false,
    "auto_punches": false,
    "smooth": true,
    "energy": 3
  },
  "graphics": {"wishlist": [], "built": []},
  "broll": {"style": "cut", "hold_min_s": 1.5, "hold_max_s": 4.0, "own_footage_floor": 0.6, "ai": "off"},
  "music": {
    "on_talking_head": true,
    "on_montage": true,
    "feel": "",
    "alone_lufs": -30,
    "under_speech_db": 22,
    "alone_db": 14,
    "ease_s": 1.5,
    "library": "music",
    "repeat_gap_videos": 6,
    "banned_md5": []
  },
  "sound": {
    "sfx": "clicks",
    "sfx_per_min": 12,
    "sfx_under_speech_db": 14,
    "voice_isolation_pct": 0,
    "master_lufs": -16,
    "true_peak_dbtp": -2.0,
    "profanity": "spoken"
  },
  "words": {"spelling": {}, "banned": []},
  "transcribe": {"engine": "local", "language": null},
  "grade": {"enabled": false, "lut": null},
  "output": {"aspect": "9:16", "size": [1080, 1920], "fps": 30, "crf": 17, "also": []},
  "delivery": {"end_card": {"on": false, "line": "", "handle": ""}, "transcript": true, "caption_file": true},
  "review": {"keep_cut_on_intake": true, "approve_before_render": true},
  "cleanup": {"after_delivery": "ask", "keep": ["plan", "words", "transcript"]},
  "storage": {"archive": "", "warn_free_gb": 50},
  "pacing": {"cuts_per_min": null, "median_shot_s": null, "text_on_screen_pct": null},
  "studies": [],
  "notes": []
}
